{
  "schema": "gate-report/v1",
  "tool": "quality_gate/1",
  "contract_version": "1.8.1",
  "product_id": "EVIDENCE-CHEM-ISS35-HYB-A",
  "subject": "Chemistry",
  "render_stamp": "render_core/2 ce7531223bb97485",
  "pages": [
    {
      "page": "core1a.html",
      "sha256": "7362ed60e3542ea0e9c3fe080c2672c50a0484b0fa21393bc1f7ebec34b2f6c3"
    },
    {
      "page": "core2.html",
      "sha256": "1d4adb94036b5d76a6b2d0031326d8669ddd0bbbccf88576dcb1f57ca9456048"
    }
  ],
  "rules_evaluated": [
    "C1-RELATION",
    "C1-REPRESENTATION",
    "C1A-BLOCKS",
    "C1A-REPRESENTATION-BRIDGE",
    "C1A-STAGED-REPRESENTATION",
    "C1A-ANCHOR-PER-DECISION",
    "C1A-PREREQUISITES-BRIDGED",
    "C1B-BLOCKS",
    "C1B-REPRESENTATION",
    "C1B-REVEAL-GATED",
    "C2-BLOCKS",
    "C2-ATTEMPT",
    "C2-ANSWER-ON-REVEAL",
    "C2-SUPPORT-PROVENANCE",
    "C2A-BLOCKS",
    "C2A-ATTEMPT-FIRST",
    "C2A-TRAP",
    "C2A-REPRESENTATION",
    "C2A-LADDER",
    "C2A-SPECIFIC-SUPPORT",
    "C2A-PROVENANCE",
    "C2A-FAMILY-CLOSURE",
    "C2A-REVEAL-GATED",
    "C2B-SAFE-REPRESENTATION",
    "C2B-LINEAGE",
    "C2B-SAFE-SUPPORT-SPECIFIC",
    "C2B-REVEAL-GATED",
    "C1-FAMILY-METADATA",
    "C2-METADATA",
    "C2A-METADATA",
    "C2B-METADATA",
    "ALL-NO-PLACEHOLDER",
    "ALL-PRE-ATTEMPT-FIGURE-PARTIAL",
    "ALL-PRE-ATTEMPT-MARKUP-WITHHELD",
    "ALL-FIGURE-SPECIFIC",
    "ALL-FIGURES-TITLED",
    "ALL-FIGURE-KIND-KNOWN",
    "ALL-CHECK-TYPES-KNOWN",
    "BP-COMPONENTS-REQUIRED",
    "BP-COMPONENTS-EXPECTED",
    "BP-COMPONENTS-DEPTH",
    "PAGE-HOME-LINK",
    "PAGE-SHELL",
    "PAGE-SLOTS",
    "PAGE-PRINT-CSS",
    "PAGE-TOUCH",
    "PAGE-STAGE-SUPPORT",
    "PAGE-METADATA-PRESENCE",
    "PAGE-SAFE-SEARCH-CORPUS",
    "PAGE-PROTECTED-SEARCH",
    "PAGE-GATED-INITIAL",
    "PRODUCT-NO-ESCAPE-STATE",
    "PRODUCT-RENDERED-FROM-RECORDS",
    "PRODUCT-ALL-ROLES",
    "PRODUCT-SHARED-ATLAS",
    "PRODUCT-PRINT-FROM-PAGE"
  ],
  "rendered_measured": true,
  "not_measured": [],
  "findings": [
    {
      "rule": "ALL-FIGURE-KIND-KNOWN",
      "severity": "S3",
      "where": "core1a.html#MIC-CHEM-HYB-DELOCALISATION",
      "detail": "figure kind not in Chemistry vocabulary: ORBITAL_MODEL"
    },
    {
      "rule": "ALL-FIGURE-KIND-KNOWN",
      "severity": "S3",
      "where": "core1a.html#MIC-CHEM-HYB-PI-ORIENTATION",
      "detail": "figure kind not in Chemistry vocabulary: ORBITAL_MODEL"
    },
    {
      "rule": "ALL-FIGURE-KIND-KNOWN",
      "severity": "S3",
      "where": "core1a.html#MIC-CHEM-HYB-LOCAL-PROCEDURE",
      "detail": "figure kind not in Chemistry vocabulary: ORBITAL_MODEL"
    },
    {
      "rule": "ALL-FIGURE-KIND-KNOWN",
      "severity": "S3",
      "where": "core2.html#OWN-ISS35-HYB-01",
      "detail": "figure kind not in Chemistry vocabulary: ORBITAL_MODEL"
    },
    {
      "rule": "ALL-FIGURE-KIND-KNOWN",
      "severity": "S3",
      "where": "core2.html#OWN-ISS35-HYB-02",
      "detail": "figure kind not in Chemistry vocabulary: ORBITAL_MODEL"
    },
    {
      "rule": "ALL-FIGURE-KIND-KNOWN",
      "severity": "S3",
      "where": "core2.html#OWN-ISS35-HYB-03",
      "detail": "figure kind not in Chemistry vocabulary: ORBITAL_MODEL"
    },
    {
      "rule": "ALL-FIGURE-KIND-KNOWN",
      "severity": "S3",
      "where": "core2.html#OWN-ISS35-HYB-04",
      "detail": "figure kind not in Chemistry vocabulary: ORBITAL_MODEL"
    },
    {
      "rule": "ALL-FIGURE-KIND-KNOWN",
      "severity": "S3",
      "where": "core2.html#OWN-ISS35-HYB-05",
      "detail": "figure kind not in Chemistry vocabulary: ORBITAL_MODEL"
    },
    {
      "rule": "ALL-FIGURE-KIND-KNOWN",
      "severity": "S3",
      "where": "core2.html#OWN-ISS35-HYB-06",
      "detail": "figure kind not in Chemistry vocabulary: ORBITAL_MODEL"
    },
    {
      "rule": "ALL-FIGURE-KIND-KNOWN",
      "severity": "S3",
      "where": "core2.html#OWN-ISS35-HYB-07",
      "detail": "figure kind not in Chemistry vocabulary: ORBITAL_MODEL"
    },
    {
      "rule": "ALL-FIGURE-KIND-KNOWN",
      "severity": "S3",
      "where": "core2.html#OWN-ISS35-HYB-08",
      "detail": "figure kind not in Chemistry vocabulary: ORBITAL_MODEL"
    },
    {
      "rule": "ALL-FIGURE-KIND-KNOWN",
      "severity": "S3",
      "where": "core2.html#OWN-ISS35-HYB-09",
      "detail": "figure kind not in Chemistry vocabulary: ORBITAL_MODEL"
    },
    {
      "rule": "ALL-FIGURE-KIND-KNOWN",
      "severity": "S3",
      "where": "core2.html#OWN-ISS35-HYB-10",
      "detail": "figure kind not in Chemistry vocabulary: ORBITAL_MODEL"
    },
    {
      "rule": "BP-COMPONENTS-EXPECTED",
      "severity": "S3",
      "where": "core1a.html",
      "detail": "MIC-CHEM-HYB-DELOCALISATION / CU-MIC-CHEM-HYB-DELOCALISATION: EQUATIONS is absent"
    },
    {
      "rule": "BP-COMPONENTS-EXPECTED",
      "severity": "S3",
      "where": "core1a.html",
      "detail": "MIC-CHEM-HYB-PI-ORIENTATION / CU-MIC-CHEM-HYB-PI-ORIENTATION: EQUATIONS is absent"
    },
    {
      "rule": "BP-COMPONENTS-EXPECTED",
      "severity": "S3",
      "where": "core1a.html",
      "detail": "MIC-CHEM-HYB-LOCAL-PROCEDURE / CU-MIC-CHEM-HYB-LOCAL-PROCEDURE: EQUATIONS is absent"
    }
  ],
  "continuity": [],
  "verdict": "PASS",
  "fail_reasons": []
}
