{
  "schema": "gate-report/v1",
  "tool": "quality_gate/1",
  "contract_version": "1.8.1",
  "product_id": "EVIDENCE-MATH-ISS55-POLY-B",
  "subject": "Mathematics",
  "render_stamp": "render_core/2 e5ea104d47258fbd",
  "pages": [
    {
      "page": "core1a.html",
      "sha256": "043e7e996bd409865fe35fd9329147d25d61fbc39a4f830841eb5bce6ce0a7c0"
    },
    {
      "page": "core2.html",
      "sha256": "ab9948e9e5d7bef3407c571229b02de094df9d69835015d9f5d8c09197d82803"
    }
  ],
  "rules_evaluated": [
    "C1-RELATION",
    "C1-REPRESENTATION",
    "C1A-BLOCKS",
    "C1A-REPRESENTATION-BRIDGE",
    "C1A-STAGED-REPRESENTATION",
    "C1A-ANCHOR-PER-DECISION",
    "C1A-PREREQUISITES-BRIDGED",
    "C1B-BLOCKS",
    "C1B-REPRESENTATION",
    "C1B-REVEAL-GATED",
    "C2-BLOCKS",
    "C2-ATTEMPT",
    "C2-ANSWER-ON-REVEAL",
    "C2-SUPPORT-PROVENANCE",
    "C2A-BLOCKS",
    "C2A-ATTEMPT-FIRST",
    "C2A-TRAP",
    "C2A-REPRESENTATION",
    "C2A-LADDER",
    "C2A-SPECIFIC-SUPPORT",
    "C2A-PROVENANCE",
    "C2A-FAMILY-CLOSURE",
    "C2A-REVEAL-GATED",
    "C2B-SAFE-REPRESENTATION",
    "C2B-LINEAGE",
    "C2B-SAFE-SUPPORT-SPECIFIC",
    "C2B-REVEAL-GATED",
    "C1-FAMILY-METADATA",
    "C2-METADATA",
    "C2A-METADATA",
    "C2B-METADATA",
    "ALL-NO-PLACEHOLDER",
    "ALL-PRE-ATTEMPT-FIGURE-PARTIAL",
    "ALL-PRE-ATTEMPT-MARKUP-WITHHELD",
    "ALL-FIGURE-SPECIFIC",
    "ALL-FIGURES-TITLED",
    "ALL-FIGURE-KIND-KNOWN",
    "ALL-CHECK-TYPES-KNOWN",
    "BP-COMPONENTS-REQUIRED",
    "BP-COMPONENTS-EXPECTED",
    "BP-COMPONENTS-DEPTH",
    "PAGE-HOME-LINK",
    "PAGE-SHELL",
    "PAGE-SLOTS",
    "PAGE-PRINT-CSS",
    "PAGE-TOUCH",
    "PAGE-STAGE-SUPPORT",
    "PAGE-METADATA-PRESENCE",
    "PAGE-SAFE-SEARCH-CORPUS",
    "PAGE-PROTECTED-SEARCH",
    "PAGE-GATED-INITIAL",
    "PRODUCT-NO-ESCAPE-STATE",
    "PRODUCT-RENDERED-FROM-RECORDS",
    "PRODUCT-ALL-ROLES",
    "PRODUCT-SHARED-ATLAS",
    "PRODUCT-PRINT-FROM-PAGE"
  ],
  "rendered_measured": false,
  "not_measured": [
    "PAGE-GATED-INITIAL",
    "PAGE-METADATA-PRESENCE",
    "PAGE-PROTECTED-SEARCH",
    "PAGE-SAFE-SEARCH-CORPUS",
    "PAGE-STAGE-SUPPORT",
    "PAGE-TOUCH"
  ],
  "findings": [],
  "continuity": [],
  "verdict": "FAIL",
  "fail_reasons": [
    "RENDERED_RULES_NOT_MEASURED"
  ]
}
