{
  "schema": "gate-report/v1",
  "tool": "quality_gate/1",
  "contract_version": "1.0.0",
  "product_id": "PRODUCT-PHY-KIN-2D-MOTION",
  "subject": "Physics",
  "render_stamp": "render_core/1 050d9b41ee8272bd",
  "pages": [
    {
      "page": "core1.html",
      "sha256": "64f6ca50fe1950baad01004b3de091e965ae4715ebe49684a6d6ad4660ad0271"
    },
    {
      "page": "core1a.html",
      "sha256": "3ffe31a70de5b557cccdeac6e4ed62db127505a5aafd31060f6228aa938ef12c"
    },
    {
      "page": "core1b.html",
      "sha256": "5009f3fd2fc9cd7541e0d60916ffc72a9801a9868108d3023e5600ea9ff326b8"
    },
    {
      "page": "core2.html",
      "sha256": "c833494efb9f0a04be077f67c1ae5946b7c0baedfb86c8912fed98cd1924b87f"
    },
    {
      "page": "core2a.html",
      "sha256": "00424280d444c1349483842039b133890a9bcbabd6e91ad6ba72ed1c3cd7cbcb"
    },
    {
      "page": "core2b.html",
      "sha256": "915e4075589ab5e5fa30f432d329dbd69bb9a37c2487565ed17b5d53d84d7448"
    }
  ],
  "rules_evaluated": [
    "C1-RELATION",
    "C1-REPRESENTATION",
    "C1A-BLOCKS",
    "C1A-REPRESENTATION-BRIDGE",
    "C1A-STAGED-REPRESENTATION",
    "C1A-ANCHOR-PER-DECISION",
    "C1A-PREREQUISITES-BRIDGED",
    "C1B-BLOCKS",
    "C1B-REPRESENTATION",
    "C1B-REVEAL-GATED",
    "C2-BLOCKS",
    "C2-ATTEMPT",
    "C2-ANSWER-ON-REVEAL",
    "C2A-BLOCKS",
    "C2A-ATTEMPT-FIRST",
    "C2A-TRAP",
    "C2A-REPRESENTATION",
    "C2A-LADDER",
    "C2A-SPECIFIC-SUPPORT",
    "C2A-PROVENANCE",
    "C2A-FAMILY-CLOSURE",
    "C2A-REVEAL-GATED",
    "C2B-SAFE-REPRESENTATION",
    "C2B-LINEAGE",
    "C2B-SAFE-SUPPORT-SPECIFIC",
    "C2B-REVEAL-GATED",
    "ALL-NO-PLACEHOLDER",
    "ALL-PRE-ATTEMPT-FIGURE-PARTIAL",
    "ALL-FIGURES-TITLED",
    "ALL-FIGURE-KIND-KNOWN",
    "ALL-CHECK-TYPES-KNOWN",
    "PAGE-HOME-LINK",
    "PAGE-SHELL",
    "PAGE-SLOTS",
    "PAGE-PRINT-CSS",
    "PAGE-TOUCH",
    "PAGE-STAGE-SUPPORT",
    "PRODUCT-NO-ESCAPE-STATE",
    "PRODUCT-RENDERED-FROM-RECORDS",
    "PRODUCT-ALL-ROLES",
    "PRODUCT-SHARED-ATLAS",
    "PRODUCT-PRINT-FROM-PAGE"
  ],
  "rendered_measured": true,
  "not_measured": [],
  "findings": [
    {
      "rule": "ALL-FIGURE-KIND-KNOWN",
      "severity": "S3",
      "where": "core1.html#MIC-PHY-KIN-2D-INDEPENDENT-COMPONENTS",
      "detail": "figure kind not in Physics vocabulary: VECTOR"
    },
    {
      "rule": "ALL-FIGURE-KIND-KNOWN",
      "severity": "S3",
      "where": "core1.html#MIC-PHY-KIN-2D-CONSTANT-ACCELERATION",
      "detail": "figure kind not in Physics vocabulary: VECTOR"
    },
    {
      "rule": "ALL-FIGURE-KIND-KNOWN",
      "severity": "S3",
      "where": "core1.html#MIC-PHY-KIN-PROJECTILE-MODEL",
      "detail": "figure kind not in Physics vocabulary: VECTOR"
    },
    {
      "rule": "ALL-FIGURE-KIND-KNOWN",
      "severity": "S3",
      "where": "core1a.html#MIC-PHY-KIN-2D-INDEPENDENT-COMPONENTS",
      "detail": "figure kind not in Physics vocabulary: VECTOR"
    },
    {
      "rule": "ALL-FIGURE-KIND-KNOWN",
      "severity": "S3",
      "where": "core1a.html#MIC-PHY-KIN-2D-CONSTANT-ACCELERATION",
      "detail": "figure kind not in Physics vocabulary: VECTOR"
    },
    {
      "rule": "ALL-FIGURE-KIND-KNOWN",
      "severity": "S3",
      "where": "core1a.html#MIC-PHY-KIN-PROJECTILE-MODEL",
      "detail": "figure kind not in Physics vocabulary: GRAPH, VECTOR"
    },
    {
      "rule": "ALL-FIGURE-KIND-KNOWN",
      "severity": "S3",
      "where": "core1b.html#MIC-PHY-KIN-2D-INDEPENDENT-COMPONENTS",
      "detail": "figure kind not in Physics vocabulary: VECTOR"
    },
    {
      "rule": "ALL-FIGURE-KIND-KNOWN",
      "severity": "S3",
      "where": "core1b.html#MIC-PHY-KIN-2D-CONSTANT-ACCELERATION",
      "detail": "figure kind not in Physics vocabulary: VECTOR"
    },
    {
      "rule": "ALL-FIGURE-KIND-KNOWN",
      "severity": "S3",
      "where": "core1b.html#MIC-PHY-KIN-PROJECTILE-MODEL",
      "detail": "figure kind not in Physics vocabulary: VECTOR"
    },
    {
      "rule": "ALL-FIGURE-KIND-KNOWN",
      "severity": "S3",
      "where": "core2a.html#Q-PHY-KIN-2D-2A-SHARED-CLOCK-01",
      "detail": "figure kind not in Physics vocabulary: VECTOR"
    },
    {
      "rule": "ALL-FIGURE-KIND-KNOWN",
      "severity": "S3",
      "where": "core2a.html#Q-PHY-KIN-2D-2A-CONSTANT-ACCEL-02",
      "detail": "figure kind not in Physics vocabulary: VECTOR"
    },
    {
      "rule": "ALL-FIGURE-KIND-KNOWN",
      "severity": "S3",
      "where": "core2a.html#Q-PHY-KIN-2D-2A-PROJECTILE-APEX-03",
      "detail": "figure kind not in Physics vocabulary: GRAPH"
    },
    {
      "rule": "ALL-FIGURE-KIND-KNOWN",
      "severity": "S3",
      "where": "core2a.html#Q-PHY-KIN-2D-2A-HORIZONTAL-LAUNCH-04",
      "detail": "figure kind not in Physics vocabulary: GRAPH, VECTOR"
    },
    {
      "rule": "ALL-FIGURE-KIND-KNOWN",
      "severity": "S3",
      "where": "core2a.html#Q-PHY-KIN-2D-2A-SAME-HEIGHT-05",
      "detail": "figure kind not in Physics vocabulary: GRAPH"
    },
    {
      "rule": "ALL-FIGURE-KIND-KNOWN",
      "severity": "S3",
      "where": "core2b.html#Q-PHY-KIN-2D-2B-REPRESENTATION-01",
      "detail": "figure kind not in Physics vocabulary: VECTOR"
    },
    {
      "rule": "ALL-FIGURE-KIND-KNOWN",
      "severity": "S3",
      "where": "core2b.html#Q-PHY-KIN-2D-2B-MODEL-VALIDITY-02",
      "detail": "figure kind not in Physics vocabulary: VECTOR"
    },
    {
      "rule": "ALL-FIGURE-KIND-KNOWN",
      "severity": "S3",
      "where": "core2b.html#Q-PHY-KIN-2D-2B-UNEQUAL-HEIGHT-03",
      "detail": "figure kind not in Physics vocabulary: GRAPH"
    },
    {
      "rule": "ALL-FIGURE-KIND-KNOWN",
      "severity": "S3",
      "where": "core2b.html#Q-PHY-KIN-2D-2B-PROJECTILE-VALIDITY-04",
      "detail": "figure kind not in Physics vocabulary: VECTOR"
    },
    {
      "rule": "ALL-FIGURE-KIND-KNOWN",
      "severity": "S3",
      "where": "core2b.html#Q-PHY-KIN-2D-2B-SAME-HEIGHT-VELOCITY-05",
      "detail": "figure kind not in Physics vocabulary: GRAPH"
    }
  ],
  "continuity": [],
  "verdict": "PASS",
  "fail_reasons": []
}
