{
  "schema": "gate-report/v1",
  "tool": "quality_gate/1",
  "contract_version": "1.5.0",
  "product_id": "PRODUCT-POLYNOMIALS",
  "subject": "Mathematics",
  "render_stamp": null,
  "pages": [],
  "rules_evaluated": [
    "C1-RELATION",
    "C1-REPRESENTATION",
    "C1A-BLOCKS",
    "C1A-REPRESENTATION-BRIDGE",
    "C1A-STAGED-REPRESENTATION",
    "C1A-ANCHOR-PER-DECISION",
    "C1A-PREREQUISITES-BRIDGED",
    "C1B-BLOCKS",
    "C1B-REPRESENTATION",
    "C1B-REVEAL-GATED",
    "C2-BLOCKS",
    "C2-ATTEMPT",
    "C2-ANSWER-ON-REVEAL",
    "C2A-BLOCKS",
    "C2A-ATTEMPT-FIRST",
    "C2A-TRAP",
    "C2A-REPRESENTATION",
    "C2A-LADDER",
    "C2A-SPECIFIC-SUPPORT",
    "C2A-PROVENANCE",
    "C2A-FAMILY-CLOSURE",
    "C2A-REVEAL-GATED",
    "C2B-SAFE-REPRESENTATION",
    "C2B-LINEAGE",
    "C2B-SAFE-SUPPORT-SPECIFIC",
    "C2B-REVEAL-GATED",
    "C1-FAMILY-METADATA",
    "C2-METADATA",
    "C2A-METADATA",
    "C2B-METADATA",
    "ALL-NO-PLACEHOLDER",
    "ALL-PRE-ATTEMPT-FIGURE-PARTIAL",
    "ALL-PRE-ATTEMPT-MARKUP-WITHHELD",
    "ALL-FIGURE-SPECIFIC",
    "ALL-FIGURES-TITLED",
    "ALL-FIGURE-KIND-KNOWN",
    "ALL-CHECK-TYPES-KNOWN",
    "PAGE-HOME-LINK",
    "PAGE-SHELL",
    "PAGE-SLOTS",
    "PAGE-PRINT-CSS",
    "PAGE-TOUCH",
    "PAGE-STAGE-SUPPORT",
    "PAGE-METADATA-PRESENCE",
    "PAGE-SAFE-SEARCH-CORPUS",
    "PAGE-PROTECTED-SEARCH",
    "PAGE-GATED-INITIAL",
    "PRODUCT-NO-ESCAPE-STATE",
    "PRODUCT-RENDERED-FROM-RECORDS",
    "PRODUCT-ALL-ROLES",
    "PRODUCT-SHARED-ATLAS",
    "PRODUCT-PRINT-FROM-PAGE"
  ],
  "rendered_measured": false,
  "not_measured": [],
  "findings": [
    {
      "rule": "PRODUCT-RENDERED-FROM-RECORDS",
      "severity": "S1",
      "where": "PRODUCT-POLYNOMIALS",
      "detail": "no governed-renderer stamp"
    },
    {
      "rule": "PRODUCT-ALL-ROLES",
      "severity": "S1",
      "where": "PRODUCT-POLYNOMIALS",
      "detail": "roles not rendered: CORE1, CORE1A, CORE1B, CORE2, CORE2A, CORE2B"
    }
  ],
  "continuity": [],
  "verdict": "FAIL",
  "fail_reasons": [
    "BLOCKING_FINDINGS"
  ]
}
